motivator_number,motivator,tagline,adjectives,question_1,question_2,question_3,translation_line,confirm_line
1,Self-Validation,Make Me Feel Important,"premium;impressive;sharp;confident;standout;respected;successful","When you pull up somewhere, what do you want this vehicle to say about you?","What do you want people to notice first—style, tech, presence, or performance?","What would make it feel like 'this is the one' the moment you see it?","You're buying something that feels special—it needs to match your standards and look right.","So premium/standout is the priority—if it looks right and feels special, we're on track… yes?"
2,Autonomy,Let Me Be Independent,"independent;flexible;in-control;simple;straightforward;no-pressure;convenient","What would make today feel simple and in your control?","Do you want a short list of best fits—or do you like exploring lots of options?","What do you want to avoid this time—waiting, back-and-forth, surprises, or pressure?","You're buying a clean, low-friction process—control and simplicity matter most.","So the win is simple/no-hassle/in-control—want me to keep this direct and efficient?"
3,Prudence,Let Me Make a Smart Choice,"smart;practical;informed;efficient;value;logical;evidence-based","When you say 'smart choice,' do you mean price, total cost, reliability, or resale?","What comparisons are you already making?","What proof helps you decide—numbers, warranty coverage, reliability history, fuel economy?","You're buying confidence through facts—show me the proof and the math.","So smart to you means [their definition]—if I bring clear facts, that helps you decide?"
4,Security,Help Me Feel Safe,"safe;dependable;secure;protected;stable;worry-free;trustworthy","What does peace of mind look like—safety features, warranty, reliability, or weather confidence?","Any past vehicle experience you never want to repeat?","Who rides with you most—and what matters because of that?","You're buying peace of mind—reliability, safety, and protection matter most.","So peace of mind is the priority—safety, reliability, and protection… right?"
5,Reward,I've Earned This,"deserved;upgraded;exciting;fun;luxurious;comfortable;refreshing","What are you most excited to enjoy—comfort, quiet ride, power, or tech?","Is this mainly practical—or a 'treat yourself' upgrade?","What's one feature that would make you smile every day?","You're buying an upgrade you'll feel every day—it should be enjoyable and worth it.","So this is an upgrade you'll enjoy—if it feels better every day, that's the win?"
6,Connection,Bring Me Closer to Others,"family-friendly;together;connected;supportive;thoughtful;meaningful","Who is this vehicle really for—just you, or your people too?","What life moments does it need to handle—school, sports, trips, weekends?","When everyone's in the car, what matters most—space, comfort, easy access, entertainment?","You're buying something that fits your life with others—comfort and usability for your people.","So the win is fits our life / helps our people—if it improves daily life for everyone, right?"
